Name,Link to profile,Post content,Link to post,source_topic,clean_content,source,importance,chunk_id,investors,funding_amount,funding_amount_pretty,funding_stage
Reevo,,"At Reevo, we're reimagining the entire revenue stack from the ground up, and we're doing it with speed. We're building software that orchestrates every go-to-market motion, enabling B2B teams to operate faster, smarter, and more collaboratively.",https://reevo.ai/,Productivity,"At Reevo, we're reimagining the entire revenue stack from the ground up, and we're doing it with speed. We're building software that orchestrates every go-to-market motion, enabling B2B teams to operate faster, smarter, and more collaboratively.",Startups Gallery,1.0,,"Coatue, Khosla Ventures, Kleiner Perkins, Uncork Capital",80000000.0,$80M,Series A
GigaML,,"At GigaML, we’re revolutionizing enterprise customer support by deploying AI agents that resolve over 1 million customer tickets monthly via voice and chat. Industry leaders like Postman and Zepto (YC’s fastest-growing company) trust our AI to navigate complex, real-world conversations with clarity, accuracy, and scalability.",https://gigaml.com/,AI,"At GigaML, we’re revolutionizing enterprise customer support by deploying AI agents that resolve over 1 million customer tickets monthly via voice and chat. Industry leaders like Postman and Zepto (YC’s fastest-growing company) trust our AI to navigate complex, real-world conversations with clarity, accuracy, and scalability.",Startups Gallery,1.0,,"Liquid 2 Ventures, Nexus Venture Partners, Redpoint Ventures, Y Combinator",61000000.0,$61M,Series A
Parable,,"Parable is building Enterprise Intelligence - the operational measurement infrastructure that gives organizations the same clarity on time that they have on money. We aggregate workplace data, decode collective patterns with AI, and answer the strategic questions executives can't answer today.",https://www.askparable.com/,Productivity,"Parable is building Enterprise Intelligence - the operational measurement infrastructure that gives organizations the same clarity on time that they have on money. We aggregate workplace data, decode collective patterns with AI, and answer the strategic questions executives can't answer today.",Startups Gallery,1.0,,"Hof Capital, Panache Ventures",16500000.0,$16.5M,Seed
Sunflower Labs,,"Sunflower Labs builds an autonomous security drone system for commercial, industrial and high-end residential properties. The Sunflower Beehive System is a unique drone-in-a-box solution built to be fully autonomous from the ground up. It integrates with existing security cameras and sensors and extends the capabilities of any security installation or team.",https://sunflower-labs.com/,Hardware,"Sunflower Labs builds an autonomous security drone system for commercial, industrial and high-end residential properties. The Sunflower Beehive System is a unique drone-in-a-box solution built to be fully autonomous from the ground up. It integrates with existing security cameras and sensors and extends the capabilities of any security installation or team.",Startups Gallery,1.0,,,16000000.0,$16M,Series B
Daylight Security,,"Daylight Security is the leading provider of Managed Agentic Security Services, offering tailored MDR solutions that are delivered by Agentic AI and backed by elite human experts. Built for the realities of modern environments, Daylight delivers fast, precise, and context-aware threat detection, investigation, and response that scales with your needs.",https://daylight.ai/,Cybersecurity,"Daylight Security is the leading provider of Managed Agentic Security Services, offering tailored MDR solutions that are delivered by Agentic AI and backed by elite human experts. Built for the realities of modern environments, Daylight delivers fast, precise, and context-aware threat detection, investigation, and response that scales with your needs.",Startups Gallery,1.0,,"Bain Capital Ventures, Craft Ventures",33000000.0,$33M,Series A
Tekeskope,,"Teleskope is redefining data security for the AI era with the industry’s first agentic platform that combines precise visibility with automated remediation. Teleskope autonomously scans, catalogs, and classifies data in motion and at rest while automating remediations that understand and adapt to each organization’s unique risk profile, enabling security teams to manage data sprawl proactively while securely enabling AI adoption.",https://www.teleskope.ai/,Cybersecurity,"Teleskope is redefining data security for the AI era with the industry’s first agentic platform that combines precise visibility with automated remediation. Teleskope autonomously scans, catalogs, and classifies data in motion and at rest while automating remediations that understand and adapt to each organization’s unique risk profile, enabling security teams to manage data sprawl proactively while securely enabling AI adoption.",Startups Gallery,1.0,,,25000000.0,$25M,Series A
Hippocratic AI,,Hippocratic AI’s mission is to develop the first safety-focused Large Language Model (LLM) for healthcare. The company believes that a safe LLM can dramatically improve healthcare accessibility and health outcomes in the world by bringing deep healthcare expertise to every human.,https://www.hippocraticai.com/,Healthcare,Hippocratic AI’s mission is to develop the first safety-focused Large Language Model (LLM) for healthcare. The company believes that a safe LLM can dramatically improve healthcare accessibility and health outcomes in the world by bringing deep healthcare expertise to every human.,Startups Gallery,1.0,,"Andreessen Horowitz, Avenir, General Catalyst, Greycroft, Kleiner Perkins, Nventures, Premji Invest, Sv Angel",126000000.0,$126M,Series C
AUI,,"AUI (Augmented Intelligence) is pioneering the next generation of conversational AI agents with Apollo. Apollo isn't just another language model; it's a breakthrough neuro-symbolic foundation model for controllable agents, designed from the ground up to finally solve the controllability problem in conversational AI.",https://www.aui.io/,AI,"AUI (Augmented Intelligence) is pioneering the next generation of conversational AI agents with Apollo. Apollo isn't just another language model; it's a breakthrough neuro-symbolic foundation model for controllable agents, designed from the ground up to finally solve the controllability problem in conversational AI.",Startups Gallery,1.0,,Egateway Capital,20000000.0,$20M,Series A
Lettuce,,"Lettuce is an automated tax and accounting product for solopreneurs, contractors and freelancers designed to help them unlock the value inside their businesses. Solopreneurs making $100,000 or more are typically overpaying their taxes by $15,000 each year. Existing products and services are built for bigger businesses, are too complex and require too much manual work for independents to manage without help",https://lettuce.co/,Fintech,"Lettuce is an automated tax and accounting product for solopreneurs, contractors and freelancers designed to help them unlock the value inside their businesses. Solopreneurs making $100,000 or more are typically overpaying their taxes by $15,000 each year. Existing products and services are built for bigger businesses, are too complex and require too much manual work for independents to manage without help",Startups Gallery,1.0,,Zeev Ventures,28000000.0,$28M,Series A
Goodword,,For the connectors who know people are everything. Goodword is a smart networking copilot that helps you turn relationships into opportunities without losing the human touch.,https://www.goodword.com/,Productivity,For the connectors who know people are everything. Goodword is a smart networking copilot that helps you turn relationships into opportunities without losing the human touch.,Startups Gallery,1.0,,"Future Back Ventures, Human Ventures",4000000.0,$4M,Seed
The Mobile-First Company,,"The Mobile-First Company builds an integrated suite of mobile apps for small teams. Its first product, Allo, is an AI phone system now used by 5,000 businesses across the world, with strong traction in the United States.",https://www.themobilefirstcompany.com/,Productivity,"The Mobile-First Company builds an integrated suite of mobile apps for small teams. Its first product, Allo, is an AI phone system now used by 5,000 businesses across the world, with strong traction in the United States.",Startups Gallery,1.0,,"Base10 Partners, Lightspeed Venture Partners",12000000.0,$12M,Seed
Bevel,,"At Bevel, we’re on a mission to extend the universal health span. The first product we are building is a mobile app that connects your health data across different platforms to help you track and monitor various parts of your life, such as sleep, recovery, and activity levels.",https://www.bevel.health/,Health & Wellness,"At Bevel, we’re on a mission to extend the universal health span. The first product we are building is a mobile app that connects your health data across different platforms to help you track and monitor various parts of your life, such as sleep, recovery, and activity levels.",Startups Gallery,1.0,,"Abstract Ventures, General Catalyst, Script Capital, South Park Commons",10000000.0,$10M,Series A
Kaizen,,"Kaizen Labs is rebuilding the government’s digital front door - bringing modern, people-first software to the public services millions of Americans rely on every day. From parks & recreation and permitting to licensing and payments, we’re replacing outdated systems with intuitive, beautiful technology designed for residents and the public servants who serve them.",https://www.kaizenlabs.com/,Productivity,"Kaizen Labs is rebuilding the government’s digital front door - bringing modern, people-first software to the public services millions of Americans rely on every day. From parks & recreation and permitting to licensing and payments, we’re replacing outdated systems with intuitive, beautiful technology designed for residents and the public servants who serve them.",Startups Gallery,1.0,,"Andreessen Horowitz, Accel, New Enterprise Associates, Seven Seven Six",21000000.0,$21M,Series A
Legora,,We’re building the world’s first truly collaborative AI for legal professionals: a workspace for boundless collaboration between lawyer ingenuity and machine intelligence.,https://legora.com/,AI,We’re building the world’s first truly collaborative AI for legal professionals: a workspace for boundless collaboration between lawyer ingenuity and machine intelligence.,Startups Gallery,1.0,,"Alt Capital, Benchmark, Bessemer Venture Partners, General Catalyst, Iconiq Growth, Redpoint Ventures, Wayfinder Ventures, Y Combinator",150000000.0,$150M,Series C
VoidZero,,"VoidZero is building a unified high-performance toolchain for JavaScript: including parser, transformer, resolver, linter, formatter, minifier, bundler, test runner, and meta framework support. Their mission is to make the next generation of JavaScript developers more productive than ever before.",https://voidzero.dev/,DevTools,"VoidZero is building a unified high-performance toolchain for JavaScript: including parser, transformer, resolver, linter, formatter, minifier, bundler, test runner, and meta framework support. Their mission is to make the next generation of JavaScript developers more productive than ever before.",Startups Gallery,1.0,,"Accel, Amplify Partners, Bgz, Peak Xv, Preston Werner Ventures, Sunflower Capital",12500000.0,$12.5M,Series A
Arya Health,,"Arya Health builds AI-powered digital agents that eliminate the administrative burden in post-acute care-so caregivers and coordinators can focus on patients, not processes. Purpose-built for home health, home care, and hospice, Arya integrates with leading EMRs to automate scheduling, compliance, onboarding, and more.",https://www.aryahealth.ai/,Healthcare,"Arya Health builds AI-powered digital agents that eliminate the administrative burden in post-acute care-so caregivers and coordinators can focus on patients, not processes. Purpose-built for home health, home care, and hospice, Arya integrates with leading EMRs to automate scheduling, compliance, onboarding, and more.",Startups Gallery,1.0,,"Acme Capital, Ridge Ventures",18200000.0,$18.2M,Series A
Applied Compute,,"Applied Compute builds Specific Intelligence for enterprises, unlocking the knowledge inside a company to train custom models and deploy an in-house agent workforce.",https://appliedcompute.com/,AI,"Applied Compute builds Specific Intelligence for enterprises, unlocking the knowledge inside a company to train custom models and deploy an in-house agent workforce.",Startups Gallery,1.0,,"Benchmark, Lux Capital, Sequoia Capital",80000000.0,$80M,Venture
Board,,"Board is a tabletop gaming console that blends the magic of video games with the feel of board games for a totally new way to play. The goal: bring people of all ages and gaming experience together face-to-face, around the table, having fun.",https://board.fun/,Gaming,"Board is a tabletop gaming console that blends the magic of video games with the feel of board games for a totally new way to play. The goal: bring people of all ages and gaming experience together face-to-face, around the table, having fun.",Startups Gallery,1.0,,"Boxgroup, First Round Capital, Lerer Hippeau",15000000.0,$15M,Seed
Vizcom,,"Vizcom builds a tool for industrial designers to create photorealistic renderings from sketches and collaborate securely with their teams. For those who aren’t familiar with industrial design, take a look at all of the physical objects around you – chairs, cars, shoes, and so on. Each one was crafted by an industrial designer.",https://www.vizcom.ai/,Design,"Vizcom builds a tool for industrial designers to create photorealistic renderings from sketches and collaborate securely with their teams. For those who aren’t familiar with industrial design, take a look at all of the physical objects around you – chairs, cars, shoes, and so on. Each one was crafted by an industrial designer.",Startups Gallery,1.0,,"Index Ventures, Radical Ventures, Unusual Ventures",27000000.0,$27M,Series B
Sweatpals,,"Sweatpals empowers users to discover fitness classes, events, and communities, and become hosts themselves, creating sustainable income streams while building authentic connections in their communities.",https://www.sweatpals.com/,Health & Wellness,"Sweatpals empowers users to discover fitness classes, events, and communities, and become hosts themselves, creating sustainable income streams while building authentic connections in their communities.",Startups Gallery,1.0,,"Andreessen Horowitz, Patron",12000000.0,$12M,Seed
Subtrate,,"Substrate is addressing one of the most important technological problems facing the United States. At the intersection of advanced manufacturing and cutting-edge physics, we are developing technologies that will reshape the semiconductor industry and strengthen America's technological leadership.",https://substrate.com/,AI,"Substrate is addressing one of the most important technological problems facing the United States. At the intersection of advanced manufacturing and cutting-edge physics, we are developing technologies that will reshape the semiconductor industry and strengthen America's technological leadership.",Startups Gallery,1.0,,"Founders Fund, General Catalyst, Long Journey Ventures",100000000.0,$100M,Seed
Mem0,,"Mem0 is the memory engine that keeps conversations contextual so users never repeat themselves and your agents respond with continuity. Mem0 Platform delivers that experience as a fully managed service—scaling, securing, and enriching memories without any infrastructure work on your side.",https://mem0.ai/,AI,"Mem0 is the memory engine that keeps conversations contextual so users never repeat themselves and your agents respond with continuity. Mem0 Platform delivers that experience as a fully managed service—scaling, securing, and enriching memories without any infrastructure work on your side.",Startups Gallery,1.0,,"Basis Set Ventures, Kindred Ventures, Peak Xv, Y Combinator",24000000.0,$24M,Series A
Cartesia,,"Our mission is to build the next generation of AI: ubiquitous, interactive intelligence that runs wherever you are.",https://www.cartesia.ai/,AI,"Our mission is to build the next generation of AI: ubiquitous, interactive intelligence that runs wherever you are.",Startups Gallery,1.0,,"A Capital, Conviction Capital, General Catalyst, Index Ventures, Kleiner Perkins, Lightspeed Venture Partners, Nventures, Sv Angel",100000000.0,$100M,Series B
Vesence,,"AI Agents in Microsoft Office. Made for Law Firms. Vesence reviews your documents, emails, and projects in Microsoft Office, before your client sees them.",https://www.vesence.com/,Productivity,"AI Agents in Microsoft Office. Made for Law Firms. Vesence reviews your documents, emails, and projects in Microsoft Office, before your client sees them.",Startups Gallery,1.0,,"20vc Fund, Creandum, Emergence Capital, Y Combinator",9000000.0,$9M,Seed
Mercor,,"Mercor’s platform relies on advanced algorithms to sift through countless profiles, conduct personalized interviews, and match candidates with the right job opportunities, aiming to cut down on the bias and inefficiencies that plague traditional hiring methods.",https://mercor.com/,HR & Recruiting,"Mercor’s platform relies on advanced algorithms to sift through countless profiles, conduct personalized interviews, and match candidates with the right job opportunities, aiming to cut down on the bias and inefficiencies that plague traditional hiring methods.",Startups Gallery,1.0,,"Benchmark, General Catalyst",350000000.0,$350M,Series C
WellTheory,,"Autoimmune conditions are rising faster than any other disease, now affecting over 50 million Americans. Yet they remain misunderstood, underdiagnosed, and overlooked. WellTheory is here to change that with a new kind of care that’s personalized, rooted in science, powered by AI, and delivered with compassion. We help people reduce symptoms, feel better, and live fuller lives — while helping employers and payors reduce their spend.",https://www.welltheory.com/,Healthcare,"Autoimmune conditions are rising faster than any other disease, now affecting over 50 million Americans. Yet they remain misunderstood, underdiagnosed, and overlooked. WellTheory is here to change that with a new kind of care that’s personalized, rooted in science, powered by AI, and delivered with compassion. We help people reduce symptoms, feel better, and live fuller lives — while helping employers and payors reduce their spend.",Startups Gallery,1.0,,"Accel, Boxgroup, General Catalyst",14000000.0,$14M,Series A
Catalyx Space,,"We're building AWS for space, providing space experiments and technology demonstrations across LEO, deep space, and lunar orbit. Our offerings include unmanned labs, testbeds for both dedicated and rideshare missions, and re-entry capsules for payload retrieval.",https://www.catalyx.space/,Aerospace,"We're building AWS for space, providing space experiments and technology demonstrations across LEO, deep space, and lunar orbit. Our offerings include unmanned labs, testbeds for both dedicated and rideshare missions, and re-entry capsules for payload retrieval.",Startups Gallery,1.0,,"Flybridge, Founders Inc, Hf0, Outlander Vc, Together Fund",5400000.0,$5.4M,Seed
Valthos,,"We develop frontier AI systems that identify biological threats and design medical countermeasures in real time. Our founding team comes from Palantir, DeepMind, the Broad Institute, and the Arc Institute.",https://valthos.com/,Biotech,"We develop frontier AI systems that identify biological threats and design medical countermeasures in real time. Our founding team comes from Palantir, DeepMind, the Broad Institute, and the Arc Institute.",Startups Gallery,1.0,,"Founders Fund, Lux Capital, Openai Startup Fund",30000000.0,$30M,Seed
Tensormesh,,"Tensormesh is the next-generation AI infrastructure company helping teams maximize GPU efficiency and accelerate large language model inference. Built on the open-source LMCache project, Tensormesh’s caching-based optimizations deliver up to 10× faster inference at a fraction of the cost. Backed by Laude Ventures and leading angels",https://www.tensormesh.ai/,AI,"Tensormesh is the next-generation AI infrastructure company helping teams maximize GPU efficiency and accelerate large language model inference. Built on the open-source LMCache project, Tensormesh’s caching-based optimizations deliver up to 10× faster inference at a fraction of the cost. Backed by Laude Ventures and leading angels",Startups Gallery,1.0,,Laude Ventures,4500000.0,$4.5M,Seed
Natural,,"Legacy payment systems are built around human-to-human interaction, though agents will soon be responsible for a majority of global transaction volume. Natural is building the payments infrastructure for this agent economy — making it easy for agents to send, receive, and manage payments with businesses, consumers, and other agents.",https://www.natural.co/,Fintech,"Legacy payment systems are built around human-to-human interaction, though agents will soon be responsible for a majority of global transaction volume. Natural is building the payments infrastructure for this agent economy — making it easy for agents to send, receive, and manage payments with businesses, consumers, and other agents.",Startups Gallery,1.0,,"Abstract Ventures, Forerunner Ventures, Human Capital, Terrain",9800000.0,$9.8M,Seed
Wonder Studios,,"Backed by LocalGlobe and Blackbird, Wonder Studios is an AI-native film studio that empowers emerging talent and produces original content. We're building an ecosystem that empowers a community of AI filmmakers, traditional creatives, and technologists, to build a new era of storytelling.",https://wonderstudios.com/,Design,"Backed by LocalGlobe and Blackbird, Wonder Studios is an AI-native film studio that empowers emerging talent and produces original content. We're building an ecosystem that empowers a community of AI filmmakers, traditional creatives, and technologists, to build a new era of storytelling.",Startups Gallery,1.0,,"Atomico, Blackbird, Localglobe",12000000.0,$12M,Seed
Chainguard,,"Founded by the industry's leading experts on open source software, security and cloud native development, we provide secure container images with low-to-no CVEs.",https://www.chainguard.dev/,Cybersecurity,"Founded by the industry's leading experts on open source software, security and cloud native development, we provide secure container images with low-to-no CVEs.",Startups Gallery,1.0,,"Amplify Partners, Ivp, Kleiner Perkins, Lightspeed Venture Partners, Mantis Vc, Redpoint Ventures, Sequoia Capital, Spark Capital",356000000.0,$356M,Series D
Generation Lab,,"Generation Lab aims to extend the human healthspan with the first test based on clinically relevant biological evidence that measures individuals’ biological age progression and risk of disease so everyone can live longer, healthier lives.",https://www.generationlab.com/,Health & Wellness,"Generation Lab aims to extend the human healthspan with the first test based on clinically relevant biological evidence that measures individuals’ biological age progression and risk of disease so everyone can live longer, healthier lives.",Startups Gallery,1.0,,Accel,11000000.0,$11M,Seed
ShopMy,,"hopMy is a premium, all-in-one, creator-centric ecosystem connecting top brands and influential creators. Our comprehensive solution streamlines partnerships with effortless seeding, affiliate, and paid—driven by direct communication and transparent analytics.",https://shopmy.us/home,Consumer,"hopMy is a premium, all-in-one, creator-centric ecosystem connecting top brands and influential creators. Our comprehensive solution streamlines partnerships with effortless seeding, affiliate, and paid—driven by direct communication and transparent analytics.",Startups Gallery,1.0,,"Avenir, Bain Capital Ventures, Bessemer Venture Partners, Menlo Ventures",70000000.0,$70M,Series B
Augment Market,,"Augment is a fintech platform building the modern marketplace and financial infrastructure for private investing. Through its seamless digital platform, accredited investors and institutions can buy and sell shares of leading pre-IPO companies from $10K to $100M.",https://www.augment.market/,Fintech,"Augment is a fintech platform building the modern marketplace and financial infrastructure for private investing. Through its seamless digital platform, accredited investors and institutions can buy and sell shares of leading pre-IPO companies from $10K to $100M.",Startups Gallery,1.0,,"Builders Vc, Neo",12000000.0,$12M,Series A
Starbridge,,"The first AI-powered go-to-market platform built for public sector sales teams. Monitor hundreds of thousands of government agencies & schools in real time for bids, meeting discussions, contract expirations, grants, budgets, procurement rules and contact data.",https://starbridge.ai/,Productivity,"The first AI-powered go-to-market platform built for public sector sales teams. Monitor hundreds of thousands of government agencies & schools in real time for bids, meeting discussions, contract expirations, grants, budgets, procurement rules and contact data.",Startups Gallery,1.0,,Craft Ventures,42000000.0,$42M,Series A
