Name,Link to profile,Post content,Link to post,source_topic,clean_content,source,importance,chunk_id,investors,funding_amount,funding_amount_pretty,funding_stage
Daytona,,"Daytona is an enterprise-grade alternative to GitHub Codespaces for administering self-hosted, secure, and standardized development environments.",https://www.daytona.io/,DevTools,"Daytona is an enterprise-grade alternative to GitHub Codespaces for administering self-hosted, secure, and standardized development environments.",Startups Gallery,1.0,,"Figma Ventures, Firestreak Ventures, Firstmark, Pace Capital, Upfront Ventures",24000000.0,$24M,Series A
Accrual,,"Accrual is building the foundation for professional accounting by unifying fragmented accounting workflows into a single system that removes manual coordination while preserving the accuracy, controls, and auditability the profession depends on.",https://accrual.com/,Fintech,"Accrual is building the foundation for professional accounting by unifying fragmented accounting workflows into a single system that removes manual coordination while preserving the accuracy, controls, and auditability the profession depends on.",Startups Gallery,1.0,,,75000000.0,$75M,Series A
Goodfire,,"Our mission is to advance humanity's understanding of AI by examining the inner workings of advanced AI models (or “AI Interpretability”). As a research-driven product organization, we bridge the gap between theoretical science and practical applications of interpretability.",https://www.goodfire.ai/,DevTools,"Our mission is to advance humanity's understanding of AI by examining the inner workings of advanced AI models (or “AI Interpretability”). As a research-driven product organization, we bridge the gap between theoretical science and practical applications of interpretability.",Startups Gallery,1.0,,"B Capital, Dfj Growth, Lightspeed Venture Partners, Menlo Ventures, South Park Commons, Wing Vc",150000000.0,$150M,Series B
Duna,,"Duna is a business onboarding platform for regulated companies — including large banks, fintechs, platforms and financial institutions. Our mission is to build global trust infrastructure by providing a digital passport for every business. Over time, this will evolve into a network for shareable identity and one-click onboarding.",https://duna.com/,Cybersecurity,"Duna is a business onboarding platform for regulated companies — including large banks, fintechs, platforms and financial institutions. Our mission is to build global trust infrastructure by providing a digital passport for every business. Over time, this will evolve into a network for shareable identity and one-click onboarding.",Startups Gallery,1.0,,"Capitalg, Index Ventures",35000000.0,$35M,Series A
Adaption,,"Adaption builds AI systems that adapt as real world conditions change. Moving beyond static and costly retraining cycles, Adaption delivers intelligence that evolves through real world interaction, enabling efficient AI across domains, languages and operational constraints. Founded by ex-Cohere leaders.",https://www.adaptionlabs.ai/,AI,"Adaption builds AI systems that adapt as real world conditions change. Moving beyond static and costly retraining cycles, Adaption delivers intelligence that evolves through real world interaction, enabling efficient AI across domains, languages and operational constraints. Founded by ex-Cohere leaders.",Startups Gallery,1.0,,"Emergence Capital, Neo, Threshold Ventures",50000000.0,$50M,Seed
Resolve AI,,"Our Agentic AI SRE investigates & resolves incidents, so that you can focus on building.  Let’s make machines be on-call for humans, not the other way around.",https://resolve.ai/,AI,"Our Agentic AI SRE investigates & resolves incidents, so that you can focus on building.  Let’s make machines be on-call for humans, not the other way around.",Startups Gallery,1.0,,"A Capital, Greylock, Lightspeed Venture Partners, Unusual Ventures",135000000.0,$135M,Series A
Bedrock Robotics,,"Bedrock Robotics brings advanced autonomy to the built world, helping the construction industry build at the pace today's society demands. Their technology upgrades existing heavy equipment, enabling truly autonomous operation with expert level quality and superhuman safety. At a time when we need to build faster than ever—from housing to data centers to factories and energy infrastructure—autonomous construction isn't just an innovation, it's an economic necessity.",https://bedrockrobotics.com/,Robotics,"Bedrock Robotics brings advanced autonomy to the built world, helping the construction industry build at the pace today's society demands. Their technology upgrades existing heavy equipment, enabling truly autonomous operation with expert level quality and superhuman safety. At a time when we need to build faster than ever—from housing to data centers to factories and energy infrastructure—autonomous construction isn't just an innovation, it's an economic necessity.",Startups Gallery,1.0,,"8vc, Capitalg, Eclipse, Georgian, Nventures",270000000.0,$270M,Series B
ElevenLabs,,"AI voice models and products powering millions of developers, creators, and enterprises. From low‑latency conversational agents to the leading AI voice generator for voiceovers and audiobooks.",https://elevenlabs.io/,AI,"AI voice models and products powering millions of developers, creators, and enterprises. From low‑latency conversational agents to the leading AI voice generator for voiceovers and audiobooks.",Startups Gallery,1.0,,"Andreessen Horowitz, Iconiq Growth, Nfdg Ventures, Sequoia Capital, Sv Angel",500000000.0,$500M,Series D
Positron,,"Positron delivers vendor freedom and faster inference for both enterprises and research teams, by allowing them to use hardware and software explicitly designed from the ground up for generative and large language models (LLMs).",https://www.positron.ai/,Hardware,"Positron delivers vendor freedom and faster inference for both enterprises and research teams, by allowing them to use hardware and software explicitly designed from the ground up for generative and large language models (LLMs).",Startups Gallery,1.0,,"Flume Ventures, Qia",230000000.0,$230M,Series B
Lotus Health,,"Lotus Health is a groundbreaking primary care app that integrates your medical records, AI, and real doctors to provide free, personalized healthcare and prescriptions.",https://lotus.ai/,Healthcare,"Lotus Health is a groundbreaking primary care app that integrates your medical records, AI, and real doctors to provide free, personalized healthcare and prescriptions.",Startups Gallery,1.0,,"Crv, Kleiner Perkins",35000000.0,$35M,Series A
Kindred,,"Kindred is not a platform for vacation rentals; it is a members-only network for house sharing. Since each participant must host their own home in order to remain a guest, there is a higher level of trust among participants. Members are trusted peers looking to travel more regularly as opposed to professional hosts looking to rent their investment property because there is no cash exchange between the guest and the host.",https://livekindred.com/,Travel,"Kindred is not a platform for vacation rentals; it is a members-only network for house sharing. Since each participant must host their own home in order to remain a guest, there is a higher level of trust among participants. Members are trusted peers looking to travel more regularly as opposed to professional hosts looking to rent their investment property because there is no cash exchange between the guest and the host.",Startups Gallery,1.0,,"Andreessen Horowitz, Bessemer Venture Partners, Caffeinated Capital, Dylan Field, New Enterprise Associates, Outset Capital",125000000.0,$125M,Series B
Day,,"Day.ai combines the features of a Meeting Assistant, CRM, and Knowledge Base into a single unified solution that replaces the manual, complicated interfaces of legacy CRM, and keeps you connected to what customers want.",https://day.ai/,Productivity,"Day.ai combines the features of a Meeting Assistant, CRM, and Knowledge Base into a single unified solution that replaces the manual, complicated interfaces of legacy CRM, and keeps you connected to what customers want.",Startups Gallery,1.0,,"20sales, Conviction Capital, Inspired Capital, Pillar Vc, Sequoia Capital, Sound Ventures, Stage 2 Capital",20000000.0,$20M,Series A
RobCo,,"Founded in 2020 out of the Technical University of Munich, RobCo is on a mission to make industrial automation more accessible, affordable, and adaptable. Its patented modular hardware kit, combined with the RobCo Studio no-code software platform, allows industrial companies of all sizes to automate repetitive and dangerous tasks quickly and with unmatched flexibility. Whether it’s machine tending, palletizing, dispensing, or welding, RobCo’s modular robot kits provide versatile end-to-end solutions that are simple to deploy and manage remotely — without heavy upfront investment or specialist expertise.",https://www.rob.co,Robotics,"Founded in 2020 out of the Technical University of Munich, RobCo is on a mission to make industrial automation more accessible, affordable, and adaptable. Its patented modular hardware kit, combined with the RobCo Studio no-code software platform, allows industrial companies of all sizes to automate repetitive and dangerous tasks quickly and with unmatched flexibility. Whether it’s machine tending, palletizing, dispensing, or welding, RobCo’s modular robot kits provide versatile end-to-end solutions that are simple to deploy and manage remotely — without heavy upfront investment or specialist expertise.",Startups Gallery,1.0,,"Greenfield Partners, Kindred Ventures, Leitmotif, Lightspeed Venture Partners, Lingotto, Sequoia Capital",100000000.0,$100M,Series C
Matic,,"Matic is reimagining the next generation of fully autonomous, helpful, and elegant home robots using AI and computer vision. Level-5 autonomy in your home. Our flagship product, Matic, is a remarkably smart, proactive, and secure floor-cleaning robot that uses photo-realistic vision with precise 3D mapping to provide a home with perpetually clean floors.",https://maticrobots.com/,Robotics,"Matic is reimagining the next generation of fully autonomous, helpful, and elegant home robots using AI and computer vision. Level-5 autonomy in your home. Our flagship product, Matic, is a remarkably smart, proactive, and secure floor-cleaning robot that uses photo-realistic vision with precise 3D mapping to provide a home with perpetually clean floors.",Startups Gallery,1.0,,"A Capital, Abstract Ventures, Basecase Capital, Nfdg Ventures, Sutter Hill Ventures, Valor Equity Partners",60000000.0,$60M,Series A
Mantis Biotech,,"We are building a unified biomedical device testing and regulatory platform that connects every stage of product development from CAD design through simulation, bench testing, and verification to FDA Q-Submissions.",https://mantisbiotech.com/,Biotech,"We are building a unified biomedical device testing and regulatory platform that connects every stage of product development from CAD design through simulation, bench testing, and verification to FDA Q-Submissions.",Startups Gallery,1.0,,"Decibel Partners, Pioneer Fund, Y Combinator",6300000.0,$6.3M,Seed
Upwind,,"Upwind Cloud Security Platform bridges intelligence from runtime to build-time, eliminating friction & boosting the productivity of your developers, security engineers, and DevOps. Upwind delivers comprehensive cloud security, precisely when and where it’s most critical.",https://www.upwind.io/,Cybersecurity,"Upwind Cloud Security Platform bridges intelligence from runtime to build-time, eliminating friction & boosting the productivity of your developers, security engineers, and DevOps. Upwind delivers comprehensive cloud security, precisely when and where it’s most critical.",Startups Gallery,1.0,,"Bessemer Venture Partners, Craft Ventures, Greylock, Leaders Fund, Tcv",250000000.0,$250M,Series B
Decagon,,"Decagon is the leading conversational AI platform empowering every brand to deliver concierge customer experience. Our AI agents provide intelligent, human-like responses across chat, email, and voice, resolving millions of customer inquiries across every language and at any time.",https://decagon.ai/,AI,"Decagon is the leading conversational AI platform empowering every brand to deliver concierge customer experience. Our AI agents provide intelligent, human-like responses across chat, email, and voice, resolving millions of customer inquiries across every language and at any time.",Startups Gallery,1.0,,"Andreessen Horowitz, Accel, Acme Capital, Bain Capital Ventures, Bond Capital, Coatue, Elad Gil",250000000.0,$250M,Series D
Flapping Airplanes,,"Flapping Airplanes is a foundational AI research lab devoted to solving the data efficiency problem. They imagine a world where models can think at the level of humans without ingesting half the internet. The proof that this is possible is all around us: whereas current systems are trained on essentially all of accessible history, humans exceed AI capabilities despite seeing at most a few billion text tokens by adulthood.",https://flappingairplanes.com/,AI,"Flapping Airplanes is a foundational AI research lab devoted to solving the data efficiency problem. They imagine a world where models can think at the level of humans without ingesting half the internet. The proof that this is possible is all around us: whereas current systems are trained on essentially all of accessible history, humans exceed AI capabilities despite seeing at most a few billion text tokens by adulthood.",Startups Gallery,1.0,,"Google Ventures, Index Ventures, Sequoia Capital",180000000.0,$180M,Seed
Outtake,,"Outtake exists to empower and facilitate trust for a digital-first world. Today, impersonation, fraud, AI-driven scams, and identity abuse spread faster than any security team can respond to. So we built something different: an agentic AI platform that proactively detects, monitors and takes down impersonators and automates protection in hours, not weeks.",https://www.outtake.ai/,Cybersecurity,"Outtake exists to empower and facilitate trust for a digital-first world. Today, impersonation, fraud, AI-driven scams, and identity abuse spread faster than any security team can respond to. So we built something different: an agentic AI platform that proactively detects, monitors and takes down impersonators and automates protection in hours, not weeks.",Startups Gallery,1.0,,"Crv, Iconiq Growth, Section 32",16500000.0,$16.5M,Series B
Rogo,,"Rogo is the secure generative AI (GenAI) platform built for elite financial institutions. Save time, unlock insights and automate workflows in days.",https://rogo.ai,Fintech,"Rogo is the secure generative AI (GenAI) platform built for elite financial institutions. Save time, unlock insights and automate workflows in days.",Startups Gallery,1.0,,"Alleycorp, Boxgroup, Company Ventures, Khosla Ventures, Mantis Vc, Original Capital, Scop Venture Capital, Sequoia Capital, Thrive Capital, Tiger Global Management",75000000.0,$75M,Series C
FLORA,,"FLORA is an applied AI HCI company building the world’s most powerful creative tools. FLORA has all the best creative AI models on one Figma-like infinite canvas, which you can connect together to build workflows that automate entire creative processes. You can try our Alpha product on our landing page.",https://www.florafauna.ai/,Design,"FLORA is an applied AI HCI company building the world’s most powerful creative tools. FLORA has all the best creative AI models on one Figma-like infinite canvas, which you can connect together to build workflows that automate entire creative processes. You can try our Alpha product on our landing page.",Startups Gallery,1.0,,"Andreessen Horowitz, Company Ventures, Hanabi Capital, Long Journey Ventures, Menlo Ventures, Redpoint Ventures",42000000.0,$42M,Series A
Pace,,"Pace is the agentic workforce for insurance. Pace’s AI agents navigate internal apps, reason across documents and make phone calls to automate tasks traditionally handled by business process outsourcers (BPOs). Pace works with leading insurers to handle mission-critical insurance operations like submission intake, policy servicing, claims handling and data entry.",https://withpace.com/,Fintech,"Pace is the agentic workforce for insurance. Pace’s AI agents navigate internal apps, reason across documents and make phone calls to automate tasks traditionally handled by business process outsourcers (BPOs). Pace works with leading insurers to handle mission-critical insurance operations like submission intake, policy servicing, claims handling and data entry.",Startups Gallery,1.0,,Sequoia Capital,10000000.0,$10M,Seed
Phia,,"Phia is building the AI alignment layer between consumers and brands. With more than 1 million downloads, Phia’s shopping agent translates real-time consumer intent into personalized discovery, powered by product intelligence from a network of 6,200 brands.",https://phia.com/,Consumer,"Phia is building the AI alignment layer between consumers and brands. With more than 1 million downloads, Phia’s shopping agent translates real-time consumer intent into personalized discovery, powered by product intelligence from a network of 6,200 brands.",Startups Gallery,1.0,,"Khosla Ventures, Kleiner Perkins, Notable Capital",35000000.0,$35M,Series A
Northwood,,"Northwood is a modern space infrastructure company focused on connecting space and Earth. The world runs on space. Space will run on Northwood. Our global ground network ensures that missions ranging from national security, to global connectivity, to disaster response can unlock their full potential and operate every day without fail.",https://www.northwoodspace.io/,Aerospace,"Northwood is a modern space infrastructure company focused on connecting space and Earth. The world runs on space. Space will run on Northwood. Our global ground network ensures that missions ranging from national security, to global connectivity, to disaster response can unlock their full potential and operate every day without fail.",Startups Gallery,1.0,,"Andreessen Horowitz, Alpine Space Ventures, Boxgroup, Founders Fund",30000000.0,$30M,Series A
Cambio,,Cambio is a software platform for world-class real estate decarbonization. We help commercial real estate owners and tenants bring their real estate portfolios to net-zero using a powerful suite of software tools and AI-based recommendations. Our mission: to take the real estate industry into the climate action era.,https://cambio.ai/,Fintech,Cambio is a software platform for world-class real estate decarbonization. We help commercial real estate owners and tenants bring their real estate portfolios to net-zero using a powerful suite of software tools and AI-based recommendations. Our mission: to take the real estate industry into the climate action era.,Startups Gallery,1.0,,"Maverick Ventures, Y Combinator",18000000.0,$18M,Series A
Ricursive Intelligence,,"Ricursive Intelligence is a frontier AI Lab focused on building self-improving systems, starting with chip design. We are reinventing chip development and closing the loop between AI and the hardware that fuels it, recursively accelerating the path to artificial superintelligence.",https://www.ricursive.com/,AI,"Ricursive Intelligence is a frontier AI Lab focused on building self-improving systems, starting with chip design. We are reinventing chip development and closing the loop between AI and the hardware that fuels it, recursively accelerating the path to artificial superintelligence.",Startups Gallery,1.0,,"Dst Global, Felicis, Lightspeed Venture Partners, Radical Ventures, Sequoia Capital",300000000.0,$300M,Series A
Synthesia,,"Synthesia is the #1 rated AI video communications platform. Thousands of companies use it to create videos in 140 languages, saving up to 80% of their time and budget. Trusted by Zoom, Xerox, Teleperformance, Amazon and more.",https://www.synthesia.io/?r=0,AI,"Synthesia is the #1 rated AI video communications platform. Thousands of companies use it to create videos in 140 languages, saving up to 80% of their time and budget. Trusted by Zoom, Xerox, Teleperformance, Amazon and more.",Startups Gallery,1.0,,"Accel, Firstmark, Google Ventures, Kleiner Perkins, New Enterprise Associates, Nventures",200000000.0,$200M,Series E
Mine,,"Mine (fka Fizz) is the #1 money app for students. Whether you want to build credit, manage your money or have no idea where to start, Fizz is there to help you every step of the way. Download the app for free to check your credit score, get personalized spending insights and take fun bite-sized courses.",https://usemine.com/,Fintech,"Mine (fka Fizz) is the #1 money app for students. Whether you want to build credit, manage your money or have no idea where to start, Fizz is there to help you every step of the way. Download the app for free to check your credit score, get personalized spending insights and take fun bite-sized courses.",Startups Gallery,1.0,,"Kleiner Perkins, Sv Angel, Y Combinator",14400000.0,$14.4M,Series A
Inferact,,"Inferact's mission is to grow vLLM as the world's AI inference engine and accelerate AI progress by making inference cheaper and faster. Founded by the creators and core maintainers of vLLM, we sit at the intersection of models and hardware—a position that took years to build.",https://inferact.ai/,AI,"Inferact's mission is to grow vLLM as the world's AI inference engine and accelerate AI progress by making inference cheaper and faster. Founded by the creators and core maintainers of vLLM, we sit at the intersection of models and hardware—a position that took years to build.",Startups Gallery,1.0,,"Andreessen Horowitz, Altimeter Capital, Lightspeed Venture Partners, Redpoint Ventures, Sequoia Capital",150000000.0,$150M,Seed
Baseten,,"Baseten is an AI infrastructure platform giving you the tooling, expertise, and hardware needed to bring great AI products to market - fast. Our proprietary Inference Stack utilizes the cutting-edge of performance research combined with highly performant and reliable infrastructure to give you out-of-the-box global availability with 99.99% of uptime.",https://www.baseten.co,DevTools,"Baseten is an AI infrastructure platform giving you the tooling, expertise, and hardware needed to bring great AI products to market - fast. Our proprietary Inference Stack utilizes the cutting-edge of performance research combined with highly performant and reliable infrastructure to give you out-of-the-box global availability with 99.99% of uptime.",Startups Gallery,1.0,,"Basecase Capital, Bond Capital, Capitalg, Conviction Capital, Greylock, Ivp, Lachy Groom, South Park Commons, Spark Capital",300000000.0,$300M,Series D
LiveKit,,"Build applications that can see, hear, and speak with an end-to-end developer platform for voice, video, and physical AI",https://livekit.io/,DevTools,"Build applications that can see, hear, and speak with an end-to-end developer platform for voice, video, and physical AI",Startups Gallery,1.0,,"Altimeter Capital, Elad Gil, Founders Inc, Hanabi Capital, Index Ventures, Redpoint Ventures",100000000.0,$100M,Series C
Railway,,Railway’s mission is to build a world where developers ship without friction. We are a platform as a service bringing human-friendly design standards to internet infrastructure to help more great ideas materialize.,https://railway.com/,DevTools,Railway’s mission is to build a world where developers ship without friction. We are a platform as a service bringing human-friendly design standards to internet infrastructure to help more great ideas materialize.,Startups Gallery,1.0,,"Lachy Groom, Redpoint Ventures, Tq Ventures, Unusual Ventures",100000000.0,$100M,Series B
Artie,,"Artie is pioneering a new category of data infrastructure: fully managed CDC streaming. From capturing changes to merges, backfills, and observability — Artie automates the entire data ingestion lifecycle. By eliminating brittle orchestration, manual backfill logic, and silent failures, Artie delivers production-grade infrastructure you can trust — with no maintenance required.",https://www.artie.com/,DevTools,"Artie is pioneering a new category of data infrastructure: fully managed CDC streaming. From capturing changes to merges, backfills, and observability — Artie automates the entire data ingestion lifecycle. By eliminating brittle orchestration, manual backfill logic, and silent failures, Artie delivers production-grade infrastructure you can trust — with no maintenance required.",Startups Gallery,1.0,,"General Catalyst, Pathlight Ventures, Standard Capital, Y Combinator",12000000.0,$12M,Series A
OpenEvidence,,"OpenEvidence is a next-generation AI platform transforming how healthcare professionals and organizations access and apply medical information. Built on cutting-edge large language models and deep clinical data, OpenEvidence enables faster, more reliable, and more personalized decision-making for clinicians and life sciences partners.",https://www.openevidence.com/,Healthcare,"OpenEvidence is a next-generation AI platform transforming how healthcare professionals and organizations access and apply medical information. Built on cutting-edge large language models and deep clinical data, OpenEvidence enables faster, more reliable, and more personalized decision-making for clinicians and life sciences partners.",Startups Gallery,1.0,,"Blackstone, Breyer Capital, Coatue, Conviction Capital, Google Ventures, Kleiner Perkins, Sequoia Capital, Thrive Capital",250000000.0,$250M,Series D
