Name,Link to profile,Post content,Link to post,source_topic,clean_content,source,importance,chunk_id,investors,funding_amount,funding_amount_pretty,funding_stage
Slash,,"Our all in one virtual card, banking, bill pay, and accounting automation platform helps entrepreneurs stay on top of their finances, allowing them to spend more time doing what they love. Slash powers over 3 billion dollars a year in purchases.",https://www.slash.com/,Fintech,"Our all in one virtual card, banking, bill pay, and accounting automation platform helps entrepreneurs stay on top of their finances, allowing them to spend more time doing what they love. Slash powers over 3 billion dollars a year in purchases.",Startups Gallery,1.0,,"Goodwater Capital, Menlo Ventures, New Enterprise Associates, Soma Capital, Y Combinator",41000000.0,$41M,Series B
Throne,,"Throne is building the first wearable for your toilet that tracks gut health and hydration with every flush. Our mission is to improve health and, one day, save lives by making gut health as easy to track as sleep. Today, WHOOP for your poop – tomorrow, the smoke detector for colon cancer.",https://www.thronescience.com/,Health & Wellness,"Throne is building the first wearable for your toilet that tracks gut health and hydration with every flush. Our mission is to improve health and, one day, save lives by making gut health as easy to track as sleep. Today, WHOOP for your poop – tomorrow, the smoke detector for colon cancer.",Startups Gallery,1.0,,"Accomplice Vc, Long Journey Ventures, Moxxie Ventures, V1 Vc",4000000.0,$4M,Seed
Palmstreet,,"San Francisco, United States",https://palmstreet.app/,,"San Francisco, United States",Startups Gallery,1.0,,"Andreessen Horowitz, Craft Ventures, Fj Labs, Headline",,,
Clair,,"New York, United States",https://getclair.com/,,"New York, United States",Startups Gallery,1.0,,"Thrive Capital, Upfront Ventures",,,
Greenlite AI,,"Greenlite AI is the leading AI agent platform for financial services. Regulated banks and fintechs — including those overseen by the OCC, FDIC, and SEC — trust Greenlite AI to automate mission-critical work like KYC, AML, and sanctions compliance.",https://www.greenlite.ai,AI,"Greenlite AI is the leading AI agent platform for financial services. Regulated banks and fintechs — including those overseen by the OCC, FDIC, and SEC — trust Greenlite AI to automate mission-critical work like KYC, AML, and sanctions compliance.",Startups Gallery,1.0,,"General Catalyst, Greylock, Y Combinator",15000000.0,$15M,Series A
Traceloop,,"Traceloop monitors your LLM app in production. It provides you with tools to detect anomalies, evaluate, fix, and deploy without breaking production.",https://www.traceloop.com/,DevTools,"Traceloop monitors your LLM app in production. It provides you with tools to detect anomalies, evaluate, fix, and deploy without breaking production.",Startups Gallery,1.0,,"Grand Ventures, Sorenson Capital, Y Combinator",6100000.0,$6.1M,Seed
New Generation,,"Our mission at New Generation is to bend the internet to you. We envision a future where interfaces are personalized and powered by LLMs. We believe all websites and interfaces will eventually incorporate an intelligence layer, and New Gen aims to provide that layer, making the internet dynamic and adaptive to users.",https://www.new-gen.ai/,AI,"Our mission at New Generation is to bend the internet to you. We envision a future where interfaces are personalized and powered by LLMs. We believe all websites and interfaces will eventually incorporate an intelligence layer, and New Gen aims to provide that layer, making the internet dynamic and adaptive to users.",Startups Gallery,1.0,,"Designer Fund, Matrix Partners, Slow Ventures, South Park Commons",4500000.0,$4.5M,Seed
Mura,,We help commercial field service companies grow – with your current systems. Mura uses AI to turn back office bottlenecks into best-in-class operations.,https://www.mura.co/,Productivity,We help commercial field service companies grow – with your current systems. Mura uses AI to turn back office bottlenecks into best-in-class operations.,Startups Gallery,1.0,,Lerer Hippeau,6000000.0,$6M,Seed
Catena Labs,,"Catena Labs is building the first AI-native financial institution to provide the financial infrastructure and services AI systems need to conduct commerce. We’re giving AI agents the tools to identify themselves and use money safely and efficiently. At the same time, we’re providing businesses and consumers a trusted, licensed financial partner with the capability to manage risk and compliance.",https://catenalabs.com/,Fintech,"Catena Labs is building the first AI-native financial institution to provide the financial infrastructure and services AI systems need to conduct commerce. We’re giving AI agents the tools to identify themselves and use money safely and efficiently. At the same time, we’re providing businesses and consumers a trusted, licensed financial partner with the capability to manage risk and compliance.",Startups Gallery,1.0,,"Andreessen Horowitz, Breyer Capital, Pillar Vc",18000000.0,$18M,Seed
Optura,,"Optura.AI transcends the traditional tech model, serving as a transformation enabler throughout the AI journey—from ideation to implementation and evolution. Our mission is to unlock AI’s potential in healthcare, driving better patient outcomes, cost optimization, and innovation.",https://www.optura.ai/,Healthcare,"Optura.AI transcends the traditional tech model, serving as a transformation enabler throughout the AI journey—from ideation to implementation and evolution. Our mission is to unlock AI’s potential in healthcare, driving better patient outcomes, cost optimization, and innovation.",Startups Gallery,1.0,,"Matrix Partners, Susa Ventures",6500000.0,$6.5M,Seed
Keep,,"Keep offers a chequing account and credit card for Canadian SMBs. Businesses get better cashback rewards on card spend, lower domestic and international wire fees, currency conversion at a fair price, and increased credit limits for working capital needs.",https://www.trykeep.com/,Fintech,"Keep offers a chequing account and credit card for Canadian SMBs. Businesses get better cashback rewards on card spend, lower domestic and international wire fees, currency conversion at a fair price, and increased credit limits for working capital needs.",Startups Gallery,1.0,,"Cambrian, Liquid 2 Ventures, Rebel Fund, Tribe Capital",23000000.0,$23M,Series A
Miter,,"Miter is an HCM, field operations, and expense management platform built for contractors. Driven by a vision of a better built world, Miter empowers the next generation of contractors to strengthen their workforce, control job costs, and accelerate jobsite execution. The platform connects people, projects, and payments, enabling contractors to build with confidence.",https://www.miter.com/,Construction,"Miter is an HCM, field operations, and expense management platform built for contractors. Driven by a vision of a better built world, Miter empowers the next generation of contractors to strengthen their workforce, control job costs, and accelerate jobsite execution. The platform connects people, projects, and payments, enabling contractors to build with confidence.",Startups Gallery,1.0,,"Bessemer Venture Partners, Coatue, Pear Vc",23000000.0,$23M,Series A
The Nuclear Company,,"The Nuclear Company is leading the modernization of nuclear construction to deploy fleet-scale nuclear power across America. By integrating proven reactor technologies with digital innovation and economies of scale, the company aims to reduce costs and shorten deployment timelines. The Nuclear Company is committed to delivering safe baseload electricity at the lowest cost, while catalyzing the nuclear industry toward rapid development in America and globally.",https://www.thenuclearcompany.com/,Energy,"The Nuclear Company is leading the modernization of nuclear construction to deploy fleet-scale nuclear power across America. By integrating proven reactor technologies with digital innovation and economies of scale, the company aims to reduce costs and shorten deployment timelines. The Nuclear Company is committed to delivering safe baseload electricity at the lowest cost, while catalyzing the nuclear industry toward rapid development in America and globally.",Startups Gallery,1.0,,"Civ, Eclipse, True Ventures",51000000.0,$51M,Series A
Cartwheel,,"Cartwheel is a powerful new way to animate characters for games, films, ads, or social. Our tool suite lets artists create editable animation for any character, seamlessly integrating into existing production workflows. Led By OpenAI And Google veterans.",https://getcartwheel.com/,Design,"Cartwheel is a powerful new way to animate characters for games, films, ads, or social. Our tool suite lets artists create editable animation for any character, seamlessly integrating into existing production workflows. Led By OpenAI And Google veterans.",Startups Gallery,1.0,,"Accel, Craft Ventures, Human Ventures, Khosla Ventures, Mvp Ventures, Pelion Venture Partners",10000000.0,$10M,Seed
Doji,,"We created Doji because as fashion lovers we were missing a place for exploration, creativity and authenticity when shopping. With Doji you can create an AI likeness of you, making it easy to try on products from different brands, explore new looks, and shop your favorites. To do this we’re developing cutting-edge diffusion models and designing novel, personalized interfaces.",https://www.doji.com/,Retail,"We created Doji because as fashion lovers we were missing a place for exploration, creativity and authenticity when shopping. With Doji you can create an AI likeness of you, making it easy to try on products from different brands, explore new looks, and shop your favorites. To do this we’re developing cutting-edge diffusion models and designing novel, personalized interfaces.",Startups Gallery,1.0,,"Seven Seven Six, Thrive Capital",3000000.0,$3M,Seed
Hedra,,"Hedra is a pioneering generative media company backed by top investors at Index, A16Z, and Abstract Ventures. We're building Hedra Studio, a multimodal creation platform capable of control, emotion, and creative intelligence.",https://www.hedra.com/,AI,"Hedra is a pioneering generative media company backed by top investors at Index, A16Z, and Abstract Ventures. We're building Hedra Studio, a multimodal creation platform capable of control, emotion, and creative intelligence.",Startups Gallery,1.0,,,32000000.0,$32M,Series A
TensorWave,,"TensorWave is a cutting-edge cloud platform designed specifically for AI workloads. Offering AMD MI300X accelerators and a best-in-class inference engine, TensorWave is a top-choice for training, fine-tuning, and inference.",https://tensorwave.com/,Infrastructure,"TensorWave is a cutting-edge cloud platform designed specifically for AI workloads. Offering AMD MI300X accelerators and a best-in-class inference engine, TensorWave is a top-choice for training, fine-tuning, and inference.",Startups Gallery,1.0,,"Amd, Nexus Venture Partners",100000000.0,$100M,Series A
Granola,,Granola is an AI meeting notepad that turns your notes into more comprehensive meeting breakdowns using your notes and transcriptions.,https://www.granola.ai/,Productivity,Granola is an AI meeting notepad that turns your notes into more comprehensive meeting breakdowns using your notes and transcriptions.,Startups Gallery,1.0,,"Betaworks Ventures, Firstminute Capital, Lightspeed Venture Partners, Nfdg Ventures, Spark Capital",43000000.0,$43M,Series B
Sent,,"Sent is a unified API and A2P communications platform that revolutionizes business messaging. Our advanced routing technology seamlessly identifies and delivers messages to contacts' primary channels, ensuring global reach while reducing messaging costs by up to 90%.",https://www.sent.dm/,DevTools,"Sent is a unified API and A2P communications platform that revolutionizes business messaging. Our advanced routing technology seamlessly identifies and delivers messages to contacts' primary channels, ensuring global reach while reducing messaging costs by up to 90%.",Startups Gallery,1.0,,"Bessemer Venture Partners, Companyon Ventures, Flybridge",3550000.0,$3.55M,Seed
Adopt AI,,"Adopt AI helps modern applications deliver an agentic experience to their end users within days. Using Adopt, end users of applications can execute complex actions across their applications via natural language commands, automate workflows, and unlock new possibilities for application innovation.",https://www.adopt.ai/,AI,"Adopt AI helps modern applications deliver an agentic experience to their end users within days. Using Adopt, end users of applications can execute complex actions across their applications via natural language commands, automate workflows, and unlock new possibilities for application innovation.",Startups Gallery,1.0,,"Elevation Capital, Powerhouse Ventures",6000000.0,$6M,Seed
Owner,,"Owner makes online growth easy for restaurants. Their software helps local restaurants compete — and win against — big national brands. Independent restaurants choose Owner because it gives them a proven system that works, not an endless set of tools to figure out.",https://www.owner.com,Food,"Owner makes online growth easy for restaurants. Their software helps local restaurants compete — and win against — big national brands. Independent restaurants choose Owner because it gives them a proven system that works, not an endless set of tools to figure out.",Startups Gallery,1.0,,"Headline, Meritech Capital",120.0,$120,Series C
Sanity,,"A fully customizable all-code backend for content-driven websites and apps, their builders and creators. Power all your content operations from a single platform.",https://www.sanity.io/,DevTools,"A fully customizable all-code backend for content-driven websites and apps, their builders and creators. Power all your content operations from a single platform.",Startups Gallery,1.0,,"Bullhound Capital, Heavybit, Iconiq Growth, Lead Edge Capital, Shopify Ventures, Threshold Ventures",85000000.0,$85M,Series C
StackAI,,"Stack AI is a no-code drag-and-drop tool to quickly design, test, and deploy AI workflows that leverage Large Language Models (LLMs), such as ChatGPT, to automate any business process.",https://www.stack-ai.com/,AI,"Stack AI is a no-code drag-and-drop tool to quickly design, test, and deploy AI workflows that leverage Large Language Models (LLMs), such as ChatGPT, to automate any business process.",Startups Gallery,1.0,,"Gradient Ventures, Lifex Ventures, Lobby Capital, Y Combinator",16000000.0,$16M,Series A
Fastino,,"Fastino powers enterprise AI developers with high-performance, task-optimized language models built to scale. Unlike generic LLMs, Fastino’s models are engineered for accuracy, speed, and security, delivering near-instant CPU inference and flexible deployment across environments.",https://www.fastino.ai/,AI,"Fastino powers enterprise AI developers with high-performance, task-optimized language models built to scale. Unlike generic LLMs, Fastino’s models are engineered for accuracy, speed, and security, delivering near-instant CPU inference and flexible deployment across environments.",Startups Gallery,1.0,,"Crv, Insight Partners, Khosla Ventures, M12, New Enterprise Associates, Valor Equity Partners",17500000.0,$17.5M,Seed
Ravio,,"Ravio equips HR & Reward teams with everything needed to remove complexity in compensation – from conducting salary reviews, running pay equity audits, managing salary bands and more.",https://ravio.com/,HR & Recruiting,"Ravio equips HR & Reward teams with everything needed to remove complexity in compensation – from conducting salary reviews, running pay equity audits, managing salary bands and more.",Startups Gallery,1.0,,"Cherry Ventures, Northzone, Spark Capital",12000000.0,$12M,Series A
NewLimit,,"NewLimit is a biotechnology company working to radically extend human healthspan. We’re developing medicines to treat age-related diseases by reprogramming the epigenome, a new therapeutic mechanism to restore regenerative potential in aged and diseased cells. We leverage functional genomics, pooled perturbation screening, and machine learning models to unravel the biology of epigenetic aging and disease using experiments of unprecedented scale.",https://www.newlimit.com/,Biotech,"NewLimit is a biotechnology company working to radically extend human healthspan. We’re developing medicines to treat age-related diseases by reprogramming the epigenome, a new therapeutic mechanism to restore regenerative potential in aged and diseased cells. We leverage functional genomics, pooled perturbation screening, and machine learning models to unravel the biology of epigenetic aging and disease using experiments of unprecedented scale.",Startups Gallery,1.0,,"Human Capital, Khosla Ventures, Kleiner Perkins, Nfdg Ventures, Valor Equity Partners",130000000.0,$130M,Series B
StackOne,,"London, United Kingdom",https://www.stackone.com/,,"London, United Kingdom",Startups Gallery,1.0,,"Google Ventures, Workday Ventures, Xtx Ventures",,,
Rainmaker,,"Rainmaker is pioneering a modern cloud seeding system to solve water scarcity and inclement weather problems. We develop and incorporate radar validation, weather-resistant UAS, numerical weather modeling, and sustainable cloud seeds into an effective precipitation enhancement solution.",https://www.rainmaker.com/,Climate,"Rainmaker is pioneering a modern cloud seeding system to solve water scarcity and inclement weather problems. We develop and incorporate radar validation, weather-resistant UAS, numerical weather modeling, and sustainable cloud seeds into an effective precipitation enhancement solution.",Startups Gallery,1.0,,"Long Journey Ventures, Lowercarbon Capital, Starship Ventures",25000000.0,$25M,Series A
Recraft,,"Recraft is the AI image generation and editing tool for brand-consistent, high-quality visuals. Powered by Recraft V3, it gives full control over style and layout. Trusted by 5M+ creatives and teams at Amazon, NVIDIA, and Salesforce.",https://www.recraft.ai/,Design,"Recraft is the AI image generation and editing tool for brand-consistent, high-quality visuals. Powered by Recraft V3, it gives full control over style and layout. Trusted by 5M+ creatives and teams at Amazon, NVIDIA, and Salesforce.",Startups Gallery,1.0,,"Accel, Khosla Ventures, Madrona",30000000.0,$30M,Series B
Atlas Data Storage,,"Atlas is focused on commercializing data storage products that leverage the unique properties of synthetic DNA: extremely high data density, 1,000+ year durability, unlimited low-cost copies, and scalability.",https://www.atlasds.com/,Infrastructure,"Atlas is focused on commercializing data storage products that leverage the unique properties of synthetic DNA: extremely high data density, 1,000+ year durability, unlimited low-cost copies, and scalability.",Startups Gallery,1.0,,"Bezos Expeditions, Rsquared Vc",155000000.0,$155M,Seed
Persona,,"San Francisco, United States",https://withpersona.com/,,"San Francisco, United States",Startups Gallery,1.0,,"Bond Capital, Coatue, First Round Capital, Founders Fund, Index Ventures, Insight Partners, Meritech Capital",,,
Plenful,,"Plenful is a healthcare AI-powered workflow automation platform for pharmacy and healthcare operations, streamlining manual and administrative tasks to reduce costs and drive revenue. Trusted by leading pharmacy and healthcare teams, Plenful provides highly configurable automation solutions for 340B auditing and savings identification, document data entry, inventory management, and other high ROI use-cases.",https://www.plenful.com/,Healthcare,"Plenful is a healthcare AI-powered workflow automation platform for pharmacy and healthcare operations, streamlining manual and administrative tasks to reduce costs and drive revenue. Trusted by leading pharmacy and healthcare teams, Plenful provides highly configurable automation solutions for 340B auditing and savings identification, document data entry, inventory management, and other high ROI use-cases.",Startups Gallery,1.0,,"Bessemer Venture Partners, Notable Capital, Susa Ventures, Tq Ventures",50000000.0,$50M,Series B
Structify,,"We handle turning messy and disparate sources into clean datasets, so you can focus on getting the insights you need. With Structify, you can easily iterate on and deliver data workflows at scale, without ever having to sacrifice on quality.",https://www.structify.ai/,DevTools,"We handle turning messy and disparate sources into clean datasets, so you can focus on getting the insights you need. With Structify, you can easily iterate on and deliver data workflows at scale, without ever having to sacrifice on quality.",Startups Gallery,1.0,,"8vc, Bain Capital Ventures",4000000.0,$4M,Seed
Nuvo,,"Onboard customers through configurable, high-converting branded experiences that accelerate credit approvals, unlock revenue, and reduce fraud.  Nuvo replaces manual forms with AI-powered application flows, real-time business and principal identity verification, and embedded credit insights—enabling confident decisions that protect and grow your business.",https://nuvo.com/,Fintech,"Onboard customers through configurable, high-converting branded experiences that accelerate credit approvals, unlock revenue, and reduce fraud.  Nuvo replaces manual forms with AI-powered application flows, real-time business and principal identity verification, and embedded credit insights—enabling confident decisions that protect and grow your business.",Startups Gallery,1.0,,"Boxgroup, Foundation Capital, Founders Fund, Human Capital, Index Ventures, Pear Vc, Sequoia Capital, Spark Capital",45000000.0,$45M,Series A
Apex,,Apex manufactures standardized satellite bus platforms from which satellites can be built that can be more quickly deployed compared to custom-built spacecraft.,https://www.apexspace.com/,Aerospace,Apex manufactures standardized satellite bus platforms from which satellites can be built that can be more quickly deployed compared to custom-built spacecraft.,Startups Gallery,1.0,,"8vc, Andreessen Horowitz, Point72 Ventures, Stepstone Group",200000000.0,$200M,Series C
Variant,,"Variant is code generation with creativity and taste. Instead of a confined conversation, you can generate endless designs from a single idea. Freely explore, discover directions you wouldn’t have thought of, and build better software as a result.",https://variant.com/,Design,"Variant is code generation with creativity and taste. Instead of a confined conversation, you can generate endless designs from a single idea. Freely explore, discover directions you wouldn’t have thought of, and build better software as a result.",Startups Gallery,1.0,,"Initialized Capital, Kindred Ventures, Ritual Capital, Y Combinator",5900000.0,$5.9M,Seed
Nous Research,,"Nous Research is a leader in the American open source AI movement. We train world-class open source language models and build infrastructure to coordinate distributed, unbiased training.",https://nousresearch.com/,AI,"Nous Research is a leader in the American open source AI movement. We train world-class open source language models and build infrastructure to coordinate distributed, unbiased training.",Startups Gallery,1.0,,"Distributed Global, Paradigm",65000000.0,$65M,Seed
Sennos,,"Sennos revolutionizes fluid monitoring with real-time, IoT-enabled solutions that transform production quality and profitability.",https://sennos.com/,Analytics,"Sennos revolutionizes fluid monitoring with real-time, IoT-enabled solutions that transform production quality and profitability.",Startups Gallery,1.0,,Eqt Ventures,15000000.0,$15M,Series A
Fora,,"Fora is a team of entrepreneurs and technologists building travel advisors, creators, and enthusiasts at the center. Its mission is to empower 100,000 travel entrepreneurs, and Fora is doing it by curating the most incredible experiences for travelers.",https://www.foratravel.com,Travel,"Fora is a team of entrepreneurs and technologists building travel advisors, creators, and enthusiasts at the center. Its mission is to empower 100,000 travel entrepreneurs, and Fora is doing it by curating the most incredible experiences for travelers.",Startups Gallery,1.0,,"Forerunner Ventures, Heartcore Capital, Insight Partners, Thrive Capital",60000000.0,$60M,Series C
Pliant,,"Pliant is a European fintech specializing in B2B payment solutions. Our modular, API-first platform helps businesses streamline spending, improve cash flow, and integrate payments into their financial workflows. Designed for industries with complex payment needs, such as travel and fleet, Pliant enables greater efficiency, control, and profitability.",https://www.getpliant.com/en/,Fintech,"Pliant is a European fintech specializing in B2B payment solutions. Our modular, API-first platform helps businesses streamline spending, improve cash flow, and integrate payments into their financial workflows. Designed for industries with complex payment needs, such as travel and fleet, Pliant enables greater efficiency, control, and profitability.",Startups Gallery,1.0,,"Motive Ventures, Speedinvest",40000000.0,$40M,Series B
